"id","text","topics","complexity","quality_score","structural_elements","num_parties","case_references"
"14","Mach One Pte Ltd, a company incorporated in Singapore, has purchased a large plot of land in the western part of Singapore and has converted the plot into a race track for motorcycle racing. Since 2014, the races have taken place every weeknight as well as during weekends from 9 pm to 12 midnight. During race days, various booths which sell food and beverages, motoring paraphernalia and magazines would be set up to cater to the race participants and spectators. A fee of $20 and $10 per entry is charged for each participant and spectator respectively. The director of Mach One, Mr Shoemaker, has arrived from the United Kingdom in 2015 to operate and manage the business at the race track. He is an expert in motorcycling races. Racing has been his one and only passion and career since he left school. Pritam was selling satay at the Esplanade Food Hub and paying a rental charge of $5000 per month to Marketplace Pte Ltd, the owner and operator of the premises. He is the only satay seller at the Esplanade Food Hub. Foreigners and locals alike crave for his special satay sauce which contained a potent combination of spices and vinegar. Shoemaker approached Pritam in 2015 to set up a food stall selling satay during race days. When Pritam told him that business was brisk at the Esplanade Food Hub, Shoemaker said, “With the fever and excitement in Singapore, my sense is that night motorcycle racing is here to stay. I strongly believe your satay sales will certainly surpass many times the meagre rental you have to pay me. Definitely more than what you earn here. I will just charge you a rental of $3000 per month.” Pritam decided to move his stall to the Mach One race track. It was reported in the newspapers that Marketplace was “disappointed” that Pritam has decided to move to Mach One. The crowd at Esplanade Food Hub had dwindled considerably in the subsequent few months. Pearline's son, Paul, was an avid racer. Pearline had often tried to dissuade Paul, who was 18 years old, from participating in motorcycling races due to the risks involved. Pearline was after all an actuarial analyst who assessed risks on a regular basis for an insurance firm. But Paul had a mind of his own. Pearline reluctantly agreed and decided to support him by attending one of his races. During the race, as the motorcyclists were negotiating a bend for the last stretch of the race, Donny suddenly cut into Paul's path resulting in the latter having to swerve immediately to avoid Donny. However, it was too late as Paul lost his balance and his motorcycle skidded away, crashing against the side boards. Pearline did not witness the accident as she had to bring her youngest child to the wash room at that time. However, when she returned to the spectator's stand, she saw on the TV screen, which was projected to the spectators at the race tracks, that her son's legs were trapped under the motorcycle as the race track staff rushed to extricate him. Pearline accompanied Paul to the hospital in an ambulance. It transpired that Paul had to amputate his leg and fix a prosthetic leg. Pearline was later diagnosed with severe depression and had to undergo full therapy for a year. Pierre Tan and his family resided in a bungalow about 70-80 metres away from the west-gate of the race track. Most of the buildings nearby were factories and warehouses. Pierre had complained to Mach One about the noise and fumes from the race track during races. During the races, the announcements made through the loudspeakers, the rumble of the motorcycles as they course around the tracks and the fumes from the motorcycles are particularly unnerving for the Tans. Moreover, Pierre Junior, who was only 9 years old, suffered from allergic reactions to the accumulation of fumes emitted during race days. With regard to Peter’s complaints, Shoemaker responded that Mach One has been given permission by the authorities in charge of the western district to set up and operate the race track. Subsidiary legislation promulgated under the Motorcycling Racing Track Licensing Act authorises the Motorcycle Racing Authority (MRA) to grant business licenses to private entities. Shoemaker also stated quite curtly to Peter, “nobody asked you guys to move here. You moved here knowing full well that this is going to be a race track!” Mach One had stacked their tyres next to the partition at the east-end of the race track which adjoined a factory owned by Peng Trading, a sole proprietor. During one of the afternoons when there was no race, a few youths entered the race compound, lighted a fire and set the tyres near the partition ablaze. They were seen fleeing from the race track premises when the fire started. Unfortunately, due to the strong winds at that time, the fire spread to Peng Trading’s factory and destroyed its carpentry workshop. As a result, Peng had to abandon three projects to construct wardrobes and other furniture for clients. One of the youths was identified by an eye-witness as Mark Lim who was the son of the managing director of Marketplace Pte Ltd, Richard Lim. However, when asked by the press, Mark denied he was ever at the race track. Whilst police investigations were ongoing, one of Mark’s schoolmates Danny posted on his personal blog as follows: “Fire at Mach One: there is no smoke without fire, you know. Mark my words!” When Shoemaker was interviewed by a TV channel, Singapore News Channel, about the fire, he said, “Business is like a race. Sometimes you win, sometimes you lose. There is no reason to destroy someone’s property just because you cannot persuade your own stall-owners to stay put. He will have to pay for this.” A few days later, Singapore News Channel reported that Mark was not present at the race track and the other youths could not be identified. After having set up his satay stall at the Mach One race track for four months, Pritam was disappointed that his satay business was only breaking even. Despite the crowds at the race track, they could not be compared to those at the Esplanade Food Hub. He longed to return to Esplanade Food Hub as soon as possible but he found out that the contract with Mach One obliges him to continue business at the races for at least eight more months. When Pritam enquired from Shoemaker as to why the satay sales were not what he had promised, Shoemaker replied brusquely, “you have to do your own calculations, Pritam. Don’t expect me to do them for you!” Pritam also discovered that the other food stalls of a similar size were paying significantly lower rental fees to Mach One. Advise the various parties of their legal rights and remedies under Singapore tort law.","negligence|duty_of_care|standard_of_care|causation|remoteness|private_nuisance|vicarious_liability|defamation|consent_defence","5","0.92","parties|scenario|legal_issues|complications|defences|timeline","7",""
"15","Last Halloween, Resorts City Sembawang (“RCS”) ran a special theme throughout the entire resort that celebrated the spirit (or should I say spirits?) of the season. Part of this was a huge, unprecedented Haunted House (about the size of a football field) that we constructed on our resort grounds, in the middle of the amusement park. It was truly a sight to behold. At every corner of the maze were ghosts, dragons, skeletons, zombies, jumpscares, what have you. The attraction was only open to teenagers 18 and up, for obvious reasons. They placed bouncers on site to ensure this. Unfortunately, a number of people who entered the House were harmed. There are three archetypal claimants in particular. First, Tom is 35 year old computer engineer at Macrosoft. He visited the House on 31 Oct with his then girlfriend Sarah. Internal CCTV footage (hidden in the House, for safety reasons) show that Tom was really quite unmoved throughout the entire thing. He even laughed at a few scares. But Sarah was scared out of her wits. Upon leaving the House Sarah was seen gesturing aggressively at Tom. Tom’s lawyer’s letter states that this was the reason they broke up. Within a week Tom developed break-up induced grief disorder, which is a recognised psychiatric injury. Second, Timmy is a 14 year old kid who stole his sister Maven’s ID to make it through our bouncers. The House was obviously too much for the kid. On CCTV he was seen darting from corner to corner. Eventually he was seen hiding in a corner, curled up into a ball, hands covering his ears, and crying. It was only until three hours later that Maven found him in that corner and dragged him out. Timmy was apparently diagnosed with PTSD, an RPI, shortly thereafter. The third claimant is Maven herself. She is 23. She was very worriedly asking for Timmy all around the resort. In the House, she looked truly worried. She searched for Timmy for about one and a half hours, during which some of the scares also caught her completely off-guard. In her demand letter, she notes that the entire experience was truly traumatising and blames us for not making it easy for people who get too scared to exit. She also blames RCS for how difficult it was to find Timmy in the maze. Maven allegedly developed an RPI shortly thereafter as well. As further background, this is the general holding structure for RCS. The overall parent is RCS Pte Ltd, which owns the entire property. The amusement park portion is leased to RCS (Amusement) Pte Ltd (“RCSA”), a fully-owned subsidiary which runs the amusement park. The Haunted House was a collaboration between RCSA and Safe Houses Pte Ltd, an external vendor. Under the agreement, RCSA would provide the personnel necessary to run the attraction. That is, the bouncers, ghosts, zombies, etc, were played by RCS’s own staff. Meanwhile, Safe Houses provided all the logistical supporting, including the House itself, the set up, and all safety equipment (such as fire extinguishers). Safe Houses was also responsible for training RCS’ personnel on how to run the Haunted House, including on the best ways to scare people.","negligence|duty_of_care|standard_of_care|causation|remoteness|psychiatric_harm|private_nuisance|vicarious_liability|consent_defence","4","0.88","parties|scenario|legal_issues|complications|defences","5",""
"16","Forest is Southeast Asia’s leading online shopping destination. It has the hugest selection of third-party sellers on our platform which includes a few luxury brands that do not appear on any of our competitor’s websites. They also have their own line of luxury goods, the “Rafflesia” series, through which we provide custom-made soaps, couture, make-up, perfumes, food, and many other popular products. Their main website, forest.biz, receives millions of visits per day from consumers and store owners alike. As such, it is supported by a veritable infrastructure of computer servers located in data centres in Singapore, Indonesia, and the U.S. Forest appointed an external vendor, Safe Servers Pte Ltd (a Singapore company) to maintain the server farm. The contract states that their “primary and inalienable responsibility is to ensure that forest.biz is always up and running – 24 hours a day, 7 days a week, 365.25 days a year”. In parallel, Forest engaged a huge cybersecurity firm, Black Cat Ltd, to ensure that their servers do not fall prey to hackers. Black Cat had been advising Safe Servers on cybersecurity best practices for our servers for a few years. On 27 June 2020, however, Forest’s website suffered a massive outage for about 48 hours. Accountants estimate that they lost $25 million in revenue from those two days alone. They then engaged Descenture, an IT consultancy, to conduct a forensic investigation into the matter. Their report establishes the following: 1. The outage occurred because more than 80% of Forest’s servers were infected with a new computer virus that had been detected in January 2020. The virus, known as Donald-2020, is named after its supposed creator, an infamous hacker. 2. Although SS had provided for the standard 300% redundancy (i.e. for every one server required there are two backups), because so many servers were infected there were not enough servers left to support the traffic we were getting that day. 3. It was not clear how Donald-2020 managed to spread so quickly and rampantly within our server farm. The world’s top cybersecurity experts are still trying to identify exactly how the virus spreads. It defies traditional expectations. Emerging consensus is that the virus converts itself into electrical signals and cross-infects computers sharing the same power source. Thus, once a particular server in a data centre gets infected, within a short time all other servers sharing the same power source also get infected. 4. However, experts disagree on how the virus works to take down a server. One view is that a single instance of the virus suffices. After establishing itself in the server’s memory, it is able to replicate itself so much that it crowds out all of the server’s resources. Other experts do not believe that the virus is capable of self-replication. They hold instead that continuous exposure to a virus source is necessary. As more and more virus copies enters a target server via the shared power source, the server gets more and more overloaded and eventually fails. 5. What was clear, however, was that Safe Servers was had been egregiously careless in wiring up the servers. To save costs, they had overloaded their power sockets significantly. Many servers were sharing power sources with servers used by other companies with far weaker cybersecurity practices. A number of them do not even have in place basic, common-sense practices like data masking. 6. By May 2020 it was generally believed in the industry that, because of Donald-2020, server farms needed to be strictly electrically-distanced. This especially for high- value servers such as ours. Attempting to infect high-value (and thus high security) servers by first infecting low-value (and low security) ones is a well-known attack vector in the hacking circles. Black Cat did not advise Safe Servers on this matter. 7. It was likely that Forest’s servers were exposed to Donald-2020 through these low- security servers. At the same time, Descenture could not rule out the possibility that Forest’s servers were also directly compromised by hackers. Thus, there were two possible and non-mutually exclusive sources of virus exposure. 8. To the extent that the virus was a result of direct hacking, then even if proper distanc- ing had been practiced, some amount of the virus would still have been spreading within our server farm. Descenture noted that since Forest’s servers were more se- cure, the level of virus exposure would have been lower. But since how the virus operates is yet unclear, they could not definitely say if they would still have suffered such a major outage. Forest wishes to pursue a battery of contractual and tortious remedies against both Safe Servers and Black Cat.","negligence|duty_of_care|standard_of_care|causation|remoteness|contributory_negligence|vicarious_liability","4","0.87","parties|scenario|legal_issues|complications|defences","5",""
"17","A new augmented reality mobile game known as “Parks and Trees Go”, or “ParkG” for short, has taken the world by storm. Gamers are asked to explore various parks and forests around Singapore and point their cameras at different types of trees. The augmented reality system then spawns, on the phone, various fruits from out of those trees which can be harvested for points. The game’s runaway success has created an epidemic of people walking around parks with their phone cameras turned on. Typically a ParkG-er would use the phone’s camera as their effective ‘eyes’ for navigation. The game is massively profitable for its maker, Elastic Labs. To celebrate one year of the game’s release, Elastic decides to hold a special event at Sentosa’s Siloso beach. They lease half the beach from the Siloso Beach Company (“SBC”) and cordon it off. There, they bring and plant a host of fully-grown, exotic local trees. At the cost of a S$50 ticket, players may enter the limited area from 10am–12pm on a certain Sunday and harvest special types of fruits made available only there and then. Yee Sun is an avid ParkG-er with multiple max-leveled accounts that he plays on three stolen iPhones. He excitedly buys a ticket and shows up before dawn to the event. He waits for 10am patiently, first in the queue outside the entrance. At the event entrance, Elastic has set up a prominent sign which reads: Event Rules 1. Enter the event venue at your own risk. We have brought in special trees for this event not usually found on the beach. Participants are advised to take care when navigating the event zone. 2. A specific rule of the event zone is that players should not walk around with their phones out. Please stop walking and remain stationary while harvesting from the trees. The event venue was built to hold 150, but Elastic had sold 500 tickets before closing sales, counting on people showing up at different times and some no shows. However, by 9am, the queue to enter had at least 250 people, and counting. The long-snaking queue encircled most of Siloso beach, preventing anyone from otherwise delightful beach activities like soccer and volley. And while people waited in the hot sun, enterprising vendors from nearby snack stalls swooped upon the queue to sell devotees over-priced, unhealthy drinks and tidbits. This was highly profitable for the SBC which ultimately owns all the snack stalls there. The problem, however, was that the event left the entire beach littered with food containers and waste. SBC had to spend $10,000 getting a professional cleaning company to do the cleanup thereafter. More importantly, when the organisers opened the event gates at 10am, there was a mad rush of ParkG-ers like Yee Sun, running around the event beach brandishing multiple phones and using their cameras as eyes. In his frenzy, Yee Sun trips over a durian that had fallen onto the beach from a tree Elastic had brought in for the event. As luck would have it, Yee Sun suffered from an old hip injury from a rugby scrum gone wrong in his younger days. Because of the fall, Yee Sun’s hip is severely fractured. An ambulance that ParkG catered promptly gets to him and treats him. But the doctors later tell him that, if not for the old injury, he would not have been injured at all. To make things worse, Yee Sun’s fall means he was unable to continue harvesting at the event. His ParkG buddies all got shiny new fruits that they tease him for missing out on. Indeed, he is now unable to walk much. He cannot play the game he dearly loves. He suffers withdrawal symptoms and eventually develops an RPI.","negligence|duty_of_care|standard_of_care|causation|remoteness|consent_defence|contributory_negligence","4","0.85","parties|scenario|legal_issues|complications|defences","5",""
"18","Carlos engaged Torts Law Firm LLP (TLF) two years ago to advise on a loan he wanted to take to purchase his 5th super-car (this time, a $2m white Ferrari Enzo). With TLF’s help, a loan of $1m was granted by Eagle Bank to finance the purchase. The loan was for a period of 10 years with monthly instalments payable and an interest rate of 10% per annum, compounded monthly. The loan was also secured on the car (meaning the Bank could confiscate the car if the borrower failed to pay up). Carlos initially wanted to ensure that only his father Leong would be personally liable for the loan even though the main beneficiary was him. Although this went against standard banking industry practices and good financial sense, TLF in attempting to do the best for its client tried to help Carlos negotiate such a term anyway. Eagle Bank, however, was having none of it. After a long email chain with TLF’s lawyers decided to send them a version of the contract which contained standard terms making both Carlos and Leong joint and severally liable for the loan. The Bank’s email was however worded tactfully to make it seem like they had agreed to the terms. It reads, “Understand your clients concerns which are very valid, especially given who Carlos’ father is. Please find attached our proposed terms for your client’s kind signature please.”. One of TLF’s first-year associates Lim misunderstood this and forwarded the email to the supervising Partner Chen. Chen in turn happily sends it off to Carlos who promptly signs the contract digitally. As you may expect by now, eventually Carlos was unable to service the loan instalments. Eagle Bank sent a letter of demand to both Carlos and Leong. Leong was furious and cut off Carlos’ credit cards. Eagle Bank exercised the security and took over the beloved Ferrari. However, Carlos’ super-cars have earned him a significant social media following over the years. His followers are mostly petrol-heads and car enthusiasts like Carlos and engage with him closely on car-related topics. When Eagle Bank confiscated his Ferrari, Carlos posted this rant on his well-followed Instagram page: PSA: Torts Law Firm LLP like Traffic Police; Avoid at All Costs My precious whitey has been confiscated by the bank all because of incompe- tent lawyers. I asked them to make sure the loan was pinned to Dad’s company and they told me it can be done so I signed the contract they sent me. Turns out it wasn’t done at all! Now Dad has temporarily cut off my money as he always does. But he will relent in a while as usual and then I will pay. Be- cause it is pegged to me now that’s why the bank can do this. All this trouble because of the lawyers. Poor whitey! Engaging TLF is like driving a Toyota Prius, only a Prius will at least eventually get you where you want to be. Many of his followers commented on the post, expressing their collective disagreement at TLF. About five minutes after Carlos’ post went live, one of his followers Sebastian wrote, “TLF is the absolute worst law firm! I paid them to do my car loan too and they completely messed up the financial terms. I ended up paying monthly compounded instead of annually compounded interest. TLF really means Too Little Finance knowledge!” Sebastian did not realise that the firm he had engaged was actually Tan, Lee, and Fern LLP. Carlos liked the comment shortly after it was posted.","negligence|defamation|vicarious_liability","3","0.82","parties|scenario|legal_issues|complications","5",""
